{
  "$schema": "http://json-schema.org/draft-07/schema#",
  "$id": "https://neuralrelay.dev/schemas/dev-to-test.schema.json",
  "title": "Dev-to-Test Handoff",
  "description": "Developer agent output consumed by the test agent. The coverage_gaps and properties_believed fields are the core innovation — they tell the test agent exactly where to focus instead of re-discovering everything from scratch.",
  "type": "object",
  "required": [
    "handoff_type",
    "files_changed",
    "functions_added",
    "unit_tests_written",
    "coverage_gaps",
    "properties_believed",
    "known_risks",
    "integration_points",
    "tokens_used",
    "timestamp"
  ],
  "additionalProperties": false,
  "properties": {
    "handoff_type": {
      "type": "string",
      "const": "dev_to_test",
      "description": "Handoff type identifier. Always 'dev_to_test' for this schema."
    },
    "files_changed": {
      "type": "array",
      "description": "All files created, modified, or deleted during implementation.",
      "items": {
        "type": "object",
        "required": ["path", "change_type", "summary"],
        "additionalProperties": false,
        "properties": {
          "path": {
            "type": "string",
            "description": "Relative file path from project root."
          },
          "change_type": {
            "type": "string",
            "enum": ["created", "modified", "deleted"],
            "description": "Whether the file was created, modified, or deleted."
          },
          "summary": {
            "type": "string",
            "description": "One-line summary of what changed in this file and why."
          }
        }
      },
      "minItems": 1
    },
    "functions_added": {
      "type": "array",
      "description": "New functions or methods introduced. Helps the test agent understand the API surface to test.",
      "items": {
        "type": "object",
        "required": ["name", "file", "signature", "purpose"],
        "additionalProperties": false,
        "properties": {
          "name": {
            "type": "string",
            "description": "Function or method name."
          },
          "file": {
            "type": "string",
            "description": "File where the function is defined."
          },
          "signature": {
            "type": "string",
            "description": "Full function signature including parameters and return type."
          },
          "purpose": {
            "type": "string",
            "description": "What this function does and when it should be called."
          }
        }
      }
    },
    "unit_tests_written": {
      "type": "object",
      "description": "Summary of unit tests the developer wrote alongside the implementation.",
      "required": ["count", "passing", "files", "summary"],
      "additionalProperties": false,
      "properties": {
        "count": {
          "type": "number",
          "description": "Total number of unit tests written.",
          "minimum": 0
        },
        "passing": {
          "type": "number",
          "description": "Number of tests currently passing.",
          "minimum": 0
        },
        "files": {
          "type": "array",
          "description": "Test file paths.",
          "items": {
            "type": "string"
          }
        },
        "summary": {
          "type": "string",
          "description": "Brief description of what the tests cover."
        }
      }
    },
    "coverage_gaps": {
      "type": "array",
      "description": "Things the developer KNOWS are untested or under-tested. Must contain at least 3 items — there are always gaps in error handling, concurrency, and edge inputs. This is the highest-value field in the entire protocol — it tells the test agent exactly where to focus. Be specific: 'race condition when concurrent token refresh' not 'needs more testing'.",
      "items": {
        "type": "string",
        "minLength": 10
      },
      "minItems": 3
    },
    "properties_believed": {
      "type": "array",
      "description": "Properties the developer believes to be true about the implementation, with confidence levels and evidence. The test agent will attempt to FALSIFY medium/low confidence properties.",
      "items": {
        "type": "object",
        "required": ["property", "confidence", "evidence"],
        "additionalProperties": false,
        "properties": {
          "property": {
            "type": "string",
            "description": "A specific, testable property of the implementation. Bad: 'code works correctly'. Good: 'validateToken always returns boolean, never throws'."
          },
          "confidence": {
            "type": "string",
            "enum": ["high", "medium", "low"],
            "description": "How confident the developer is. high: type-checked + tested. medium: tested but edge cases unclear. low: believed true but not verified."
          },
          "evidence": {
            "type": "string",
            "description": "Why the developer believes this property holds. Reference specific tests, type hints, or reasoning."
          }
        }
      },
      "minItems": 1
    },
    "known_risks": {
      "type": "array",
      "description": "Edge cases, race conditions, performance concerns, or security considerations identified but not fully addressed during implementation.",
      "items": {
        "type": "string"
      }
    },
    "integration_points": {
      "type": "array",
      "description": "External systems, APIs, databases, or services this code interacts with. Helps the test agent understand what needs mocking vs integration testing.",
      "items": {
        "type": "string"
      }
    },
    "inline_requirements": {
      "type": "array",
      "description": "Brief requirements extracted from the task description. Used in quick mode when no BA handoff exists. Each item is one requirement or constraint inferred from the task description.",
      "items": {
        "type": "string"
      }
    },
    "tokens_used": {
      "type": "number",
      "description": "Total tokens consumed by the developer agent during this stage.",
      "minimum": 0
    },
    "timestamp": {
      "type": "string",
      "format": "date-time",
      "description": "ISO 8601 timestamp of when this handoff was produced."
    }
  }
}
